Track Name,Artist,Album,Popularity,Preview URL,Album Art,Spotify Link,NFT Description
A Sky Full of Stars,Coldplay,Ghost Stories,90,,https://i.scdn.co/image/ab67616d0000b273e5a95573f1b91234630fd2cf,https://open.spotify.com/track/0FDzzruyVECATHXKHFs9eJ,"A euphoric blend of EDM heartbeat and Coldplay’s celestial soul. With soaring vocals and a cosmic drop that bursts like stardust, this track radiates hope, unity, and universal replay value. Minted for dreamers and festival-goers, this is a Legendary Drop in every sense. ✨🌌💫"
Good Days,SZA,SOS,85,,https://i.scdn.co/image/ab67616d0000b27370dbc9f47669d120ad874ec1,https://open.spotify.com/track/4PMqSO5qyjpvzhlLI5GnID,"Soul-bending and meditative, Good Days is SZA’s audio diary of healing and internal battles. Its soft vocal layers and lo-fi instrumental wrap listeners in emotional warmth. A Rare Chill Token for collectors who value vulnerability, vibe, and vinyl-worthy emotional depth. 🌱💫"
Unforgettable,French Montana,Jungle Rules,88,,https://i.scdn.co/image/ab67616d0000b2738a31195a371b2233456f6c07,https://open.spotify.com/track/3B54sVLJ402zGa6Xm4YGNe,"With hypnotic afrobeat rhythms and Swae Lee’s floating hook, Unforgettable is a heatwave in audio form. It’s one of those endlessly loopable tracks with late-night dancefloor magic. An NFT classic that oozes High Replay Energy, minted for summer drops and global playlists alike. 🔥🌍"
I'll Never Love Again - Film Version,Lady Gaga,A Star Is Born Soundtrack,71,,https://i.scdn.co/image/ab67616d0000b273e2d156fdc691f57900134342,https://open.spotify.com/track/4A7EkKijzA4ryEoCRWJzdG,✨ Description not available yet
BIRDS OF A FEATHER,Billie Eilish,HIT ME HARD AND SOFT,100,,https://i.scdn.co/image/ab67616d0000b27371d62ea7ea8a5be92d3c1f62,https://open.spotify.com/track/6dOtVTDdiauQNBQEDOtlAB,✨ Description not available yet
NUEVAYoL,Bad Bunny,DeBÍ TiRAR MáS FOToS,94,,https://i.scdn.co/image/ab67616d0000b273bbd45c8d36e0e045ef640411,https://open.spotify.com/track/5TFD2bmFKGhoCRbX61nXY5,✨ Description not available yet
Espresso,Sabrina Carpenter,Please Please Please,71,,https://i.scdn.co/image/ab67616d0000b273255ec9ddd8af81fd9aba2ced,https://open.spotify.com/track/1vLqigPHwiFnXsfrLMehV1,"Sassy, sharp, and sugar-rushed — Espresso is a caffeine shot of confidence wrapped in bubblegum brilliance. Sabrina struts through the track with lyrical sparkle and TikTok-tier catchiness. This one’s a Rare Pop Spike, minted for collector playlists that scream ✨fun ✨. ☕💃"
Chemtrails Over The Country Club,Lana Del Rey,Chemtrails Over The Country Club,82,,https://i.scdn.co/image/ab67616d0000b273ca929c6e766cb8591a286e0d,https://open.spotify.com/track/7bPWdJgx8vek7S5i5yAtvG,✨ Description not available yet
